{
	"schemaVersion": "pi-extension.v0",
	"id": "com.pi.template.echo",
	"name": "Pi Zig Echo Template",
	"version": "0.1.0",
	"description": "A capability-free Zig WASM tool extension template.",
	"artifact": {
		"kind": "wasm-component",
		"path": "wasm/plugin.wasm"
	},
	"tool": {
		"id": "template.echo",
		"description": "Echoes a message field from the JSON input.",
		"inputSchema": {
			"type": "object",
			"required": ["message"],
			"properties": {
				"message": { "type": "string" }
			}
		},
		"outputSchema": {
			"type": "object",
			"required": ["message"],
			"properties": {
				"message": { "type": "string" }
			}
		}
	},
	"capabilities": [],
	"resourceLimits": {
		"timeoutMs": 1000,
		"outputBytes": 65536
	}
}
